{
 "schema_version": 1,
 "key": "bratteli-robinson-1",
 "holder": "Springer-Verlag Berlin Heidelberg",
 "status": "copyright",
 "licence": "all rights reserved (copyright page)",
 "redistribution": "never",
 "quotation": "short quotations with attribution only (one sentence or one formula per provenance row; COORDINATION.md rule 5)",
 "storage_policy": "payload and extracted text stay in the gitignored sources/<key>/; only source.json, rights.json and hashes are tracked",
 "public_artifacts": "conventional citation and project-authored exposition; no page images, no extracted text",
 "basis": "copyright page read from the page image (PDF page 4): 'This work is subject to copyright. All rights are reserved ...'; '(c) Springer-Verlag Berlin Heidelberg 1979, 1987'",
 "unchecked": [
  "the exact scope of the quotation right for the published course (German UrhG section 51 not assessed)"
 ]
}
