{
 "schema_version": 1,
 "key": "brief",
 "holder": "Tobias J. Osborne",
 "status": "own-work",
 "redistribution": "allowed",
 "quotation": "free; quoted verbatim, nothing added",
 "storage_policy": "tracked in this repository",
 "basis": "the author's own text, already tracked in this repository"
}
